{
  "name": "GitHub Dark Dimmed",
  "polarity": "dark",
  "colors": {
    "background": "#22272e",
    "foreground": "#adbac7",
    "foregroundStrong": "#cdd9e5",
    "muted": "#768390",
    "red": "#f47067",
    "orange": "#e0823d",
    "yellow": "#c69026",
    "green": "#57ab5a",
    "cyan": "#39c5cf",
    "blue": "#539bf5",
    "purple": "#b083f0",
    "pink": "#c96198"
  },
  "roles": {
    "website": {
      "github.com": "foregroundStrong",
      "*.github.com": "foregroundStrong",
      "raw.githubusercontent.com": "foregroundStrong",
      "*.githubusercontent.com": "foregroundStrong",
      "*": "muted"
    }
  }
}
